_id,id,year,title,genres,actors,director,plot,release_date,rotten_tomatoes,poster,runtime,imdb_rating
66e25b649a310417bb9e4931,tt26787296,2023,Burning Betrayal,"['Drama', 'Mystery', 'Romance']","['Giovanna Lancellotti', 'Leandro Lima', 'Camilla de Lucas']",['Diego Freitas'],"Babi discovers a betrayal by her long-term partner and decides to embark on a new adventure in life. On this journey, she meets judge Marco and they begin to live a story permeated by a lot of sexual tension.",25 Oct 2023,,https://m.media-amazon.com/images/M/MV5BYTMxMDIwY2UtZTYwOC00NmQ1LWE4MDgtMWNkMjIwYzZlMzUwXkEyXkFqcGdeQXVyMDI4NzUzMw@@._V1_SX300.jpg,98 min,4.1
66e1ec979a310417bb9e48f1,tt11827628,2022,Memory,"['Action', 'Crime', 'Thriller']","['Liam Neeson', 'Guy Pearce', 'Taj Atwal']",['Martin Campbell'],"Alex Lewis (Liam Neeson) is an expert assassin with a reputation for discreet precision. Caught in a moral quagmire, Alex refuses to complete a job that violates his code and must quickly hunt down and kill the people who hired him before they and FBI agent Vincent Serra (Guy Pearce) find him first. Alex is built for revenge but, with a memory that is beginning to falter, he is forced to question his every action, blurring the line between right and wrong.",29 Apr 2022,29%,https://m.media-amazon.com/images/M/MV5BOGI5N2FhNzktZjZlNi00MmRjLWE1MmUtNjRlNzQyOGMzYjNhXkEyXkFqcGdeQXVyMDA4NzMyOA@@._V1_SX300.jpg,114 min,5.7
66d7af08c6dc28fe94974128,tt8912936,2022,DC League of Super-Pets,"['Animation', 'Action', 'Adventure']","['Dwayne Johnson', 'Kevin Hart', 'Kate McKinnon']","['Jared Stern', 'Sam J. Levine']","When the Justice League are captured by Lex Luthor, Superman's dog, Krypto, forms a team of shelter-pets who were given super-powers: A hound named Ace, who becomes super-strong, a pig named PB, who can grow to giant-size, a turtle named Merton, who becomes super-fast, and a squirrel named Chip, who gains electric-powers.",29 Jul 2022,72%,https://m.media-amazon.com/images/M/MV5BZTIyNzc3NzMtNGE5YS00Yjg5LTk5MDMtOTUxMzk1ZTBkOTgwXkEyXkFqcGdeQXVyODE5NzE3OTE@._V1_SX300.jpg,105 min,7.1
66e25b6d9a310417bb9e4955,tt11390180,2021,Upon the Magic Roads,"['Adventure', 'Fantasy']","['Paulina Andreeva', 'Ekaterina Baygozina', 'Polina Bezborodova']",['Oleg Pogodin'],"Foal and his friend John go on an unforgettable journey as they outsmart the tyrant King, catch the fire-bird and find John's true love upon the magic roads.",18 Feb 2021,,https://m.media-amazon.com/images/M/MV5BZTIwMTM4ODAtNzg3Ni00ZWE0LTk2NjQtOWJjMzgwN2M3YTZkXkEyXkFqcGdeQXVyOTE4NzcwNzI@._V1_SX300.jpg,111 min,5.7
66e1ece29a310417bb9e4903,tt27116016,2023,Die Hart,"['Action', 'Comedy']","['Kevin Hart', 'John Travolta', 'Nathalie Emmanuel']",['Eric Appel'],"Kevin Hart - playing a version of himself - is on a death-defying quest to become an action star. And with a little help from John Travolta, Nathalie Emmanuel, and Josh Hartnett - he just might pull it off.",02 Mar 2023,,https://m.media-amazon.com/images/M/MV5BMTVhN2I0MTYtYzJjZS00MzRjLTliYmEtNTExNmFjZjA5YTU0XkEyXkFqcGdeQXVyMzM1OTgxMDc@._V1_SX300.jpg,84 min,5.2
66e1ec009a310417bb9e48cf,tt14997890,2023,Role Play,"['Action', 'Thriller']","['Kaley Cuoco', 'David Oyelowo', 'Bill Nighy']",['Thomas Vincent'],"Emma has a wonderful husband and two kids in the suburbs of New Jersey. She also has a secret life as an assassin for hire, a secret that her husband Dave discovers when the couple decide to spice up their marriage with a little r...",12 Jan 2024,,https://m.media-amazon.com/images/M/MV5BZWM3YjdhZjQtNWEwMS00YjVhLWFmMDUtMzU0ZTI0OTdkNWExXkEyXkFqcGdeQXVyMTUzMTg2ODkz._V1_SX300.jpg,100 min,N/A
66e25b619a310417bb9e4929,tt15767808,2023,The Last Kingdom: Seven Kings Must Die,"['Action', 'Drama', 'History']","['Mark Rowley', 'Pekka Strang', 'Zoltán Andrási']",['Edward Bazalgette'],"In the wake of King Edward's death, Uhtred of Bebbanburg and his comrades adventure across a fractured kingdom in the hopes of uniting England at last.",14 Apr 2023,48/100,https://m.media-amazon.com/images/M/MV5BOTlmNGE0ZGMtMzdkMC00MjQyLWI1ZjgtZTIxODAyNWJlZDFlXkEyXkFqcGdeQXVyNTQ4ODM2NjM@._V1_SX300.jpg,117 min,6.9
66e1ebd69a310417bb9e48c6,tt11365186,2022,Redeeming Love,"['Drama', 'Romance', 'Western']","['Abigail Cowen', 'Tom Lewis', 'Eric Dane']",['D.J. Caruso'],"Based on the bestselling novel by Francine Rivers, REDEEMING LOVE is a powerful story of relentless love and perseverance as a young couple's relationship clashes with the harsh realities of the California Gold Rush of 1850. It is a life-changing story of the power of unconditional and all-consuming love. Coming to theaters January 21, 2022, REDEEMING LOVE shows there is no brokenness that love can't heal.",21 Jan 2022,11%,https://m.media-amazon.com/images/M/MV5BMjRkZGQzNzctYjliYS00ZTY2LTg5MWMtODlmZTk2ODM0ZDE0XkEyXkFqcGdeQXVyODEzOTY2ODE@._V1_SX300.jpg,134 min,6.7
66df52caa244d12c4235149c,tt14114802,2022,The Outfit,"['Crime', 'Drama', 'Mystery']","['Mark Rylance', 'Zoey Deutch', 'John Gumley-Mason']",['Graham Moore'],"Leonard (Mark Rylance), a master English tailor who's ended up in Chicago, operates a corner tailor shop with his assistant (Zoey Deutch) where he makes beautiful clothes for the only people around who can afford them: a family of vicious gangsters. One night, two killers (Dylan O'Brien, Johnny Flynn) knock on his door in need of a favor - And Leonard is thrust onto the board in a deadly game of deception and murder.",18 Mar 2022,86%,https://m.media-amazon.com/images/M/MV5BYWQ0NWUyMjktYjg4Yy00NmY3LTg2YzEtNWY5OTY5YTc2MjhjXkEyXkFqcGdeQXVyMTA2MDU0NjM5._V1_SX300.jpg,105 min,7.2
66e60d71e2f69f45e61cb33b,tt9907782,2021,The Cursed,"['Fantasy', 'Horror', 'Mystery']","['Boyd Holbrook', 'Kelly Reilly', 'Alistair Petrie']",['Sean Ellis'],"In the late nineteenth century, brutal land baron Seamus Laurent slaughters a Roma clan, unleashing a curse on his family and village. In the days that follow, the townspeople are plagued by nightmares, Seamus's son Edward goes missing, and a boy is found murdered. The locals suspect a wild animal, but visiting pathologist John McBride warns of a more sinister presence lurking in the woods.",18 Feb 2022,71%,https://m.media-amazon.com/images/M/MV5BMjllNWFhZWUtN2NlNi00NDBmLWE5MjgtMGM3ZGQyNjk1NjQ5XkEyXkFqcGdeQXVyMTM1MTE1NDMx._V1_SX300.jpg,111 min,6.2
66e25b619a310417bb9e4925,tt22687790,2023,A Haunting in Venice,"['Crime', 'Drama', 'Horror']","['Kenneth Branagh', 'Michelle Yeoh', 'Jamie Dornan']",['Kenneth Branagh'],"In post-World War II Venice, Poirot, now retired and living in his own exile, reluctantly attends a seance. But when one of the guests is murdered, it is up to the former detective to once again uncover the killer.",15 Sep 2023,75%,https://m.media-amazon.com/images/M/MV5BOTgwODdhZTMtYTFiNy00NzI1LTkwZWEtNjI2NWZiMzFmMjJlXkEyXkFqcGc@._V1_SX300.jpg,103 min,6.5
66e1eca09a310417bb9e48f3,tt17569526,2023,Acid,"['Drama', 'Sci-Fi']","['Guillaume Canet', 'Laetitia Dosch', 'Patience Munchenbach']",['Just Philippot'],"In the middle of a heat wave, an ominous cloud appears and with it, a lethal acid rain. A separated family will have to come together to escape this plague ravaging the world.",20 Sep 2023,,https://m.media-amazon.com/images/M/MV5BNGViMjhmYWItMWYxOS00ZWFlLWJlMzQtOGRkNDUyNzJlMDhjXkEyXkFqcGdeQXVyMzA4MDA0Mjc@._V1_SX300.jpg,99 min,5.1
66d7ae51c6dc28fe94973f74,tt9411972,2022,Where the Crawdads Sing,"['Drama', 'Mystery', 'Romance']","['Daisy Edgar-Jones', 'Taylor John Smith', 'Harris Dickinson']",['Olivia Newman'],"Kya Clark, otherwise known as the Marsh Girl by the townspeople of Barkley Cove, is mysterious and wild. Abandoned by her family, Where the Crawdads Sing is a coming of age story of a young girl raised by the marshlands of the south in the 50's. Watching many years past, when the town hotshot is found dead, and inexplicably linked to Kya, the Marsh Girl is the prime suspect in his murder case.",15 Jul 2022,34%,https://m.media-amazon.com/images/M/MV5BMTJmNGJmYTgtYjAxNy00YmMzLTk2YTYtMGIzMmUwNDMyMTY1XkEyXkFqcGdeQXVyMTEyMjM2NDc2._V1_SX300.jpg,125 min,7.2
66e1ec2d9a310417bb9e48da,tt22939186,2024,Arcadian,"['Action', 'Drama', 'Horror']","['Nicolas Cage', 'Jaeden Martell', 'Maxwell Jenkins']",['Benjamin Brewer'],A father and his twin teenage sons fight to survive in a remote farmhouse at the end of the world.,12 Apr 2024,,https://m.media-amazon.com/images/M/MV5BMDI1ZTc1MDAtYWY3Mi00OWM5LWFkZTUtMWM1Yjc1ZjFiOWYzXkEyXkFqcGdeQXVyMTUzMTg2ODkz._V1_SX300.jpg,92 min,5.5
66e1ebb19a310417bb9e48bf,tt12747748,2023,Leave the World Behind,"['Drama', 'Mystery', 'Thriller']","['Julia Roberts', 'Mahershala Ali', 'Ethan Hawke']",['Sam Esmail'],"A family's getaway to a luxurious rental home takes an ominous turn when a cyberattack knocks out their devices, and two strangers appear at their door.",08 Dec 2023,73%,https://m.media-amazon.com/images/M/MV5BMTUzM2I3NDEtMjNhYi00NTQ0LThmZDItZTMyMzM2MjJmZGRjXkEyXkFqcGdeQXVyMTU3NDU4MDg2._V1_SX300.jpg,138 min,6.4
66e60d72e2f69f45e61cb33c,tt11976532,2022,Vengeance,"['Comedy', 'Music', 'Mystery']","['B.J. Novak', 'Boyd Holbrook', 'Lio Tipton']",['B.J. Novak'],A writer from New York City attempts to solve the murder of a girl he hooked up with and travels down south to investigate the circumstances of her death and discover what happened to her.,29 Jul 2022,82%,https://m.media-amazon.com/images/M/MV5BNDkyZGFjZDEtODdiZS00YmJiLWE2NTEtZGIxMTUzN2ZjZjA3XkEyXkFqcGdeQXVyMDA4NzMyOA@@._V1_SX300.jpg,107 min,6.8
66e60d72e2f69f45e61cb33d,tt14034294,2024,Vanished Into the Night,"['Drama', 'Thriller']","['Riccardo Scamarcio', 'Annabelle Wallis', 'Massimiliano Gallo']",['Renato De Maria'],"A father, immersed in a difficult divorce process, embarks on a dangerous mission when his children disappear from their isolated country house.",11 Jul 2024,33%,https://m.media-amazon.com/images/M/MV5BMjM4NjEwNDctYTZkZS00YzU1LTg2MzctN2JjMDI0YWRhNGZlXkEyXkFqcGc@._V1_SX300.jpg,92 min,5.2
66e25b609a310417bb9e4922,tt16444610,2021,Megaboa,"['Action', 'Horror']","['Eric Roberts', ""Michelle Elizabeth O'Shea"", 'Emilia Torello']",['Mario N. Bonassin'],A group of college students head into the rainforest to look for cave drawings. But a once thought to be extinct fifty-foot boa constrictor is out hungry for blood.,31 Dec 2021,,https://m.media-amazon.com/images/M/MV5BNzQ4ZTAyYTQtOTA5Mi00NDU3LWE1MzctNzk4M2Y0ZjYwZmVkXkEyXkFqcGdeQXVyNDEyNzAyMTE@._V1_SX300.jpg,85 min,2.7
66d7ae2ac6dc28fe94973f19,tt11847410,2021,The Fallout,['Drama'],"['Jenna Ortega', 'Maddie Ziegler', 'Niles Fitch']",['Megan Park'],"'The Fallout' is a film about the unseen faces of a tragedy, those who can't turn their pain into effecting positive change in the world because they are too afraid to leave their bedrooms. Three teenagers form a unique and dynamic bond as they navigate the never linear, often confusing journey to heal in a world that feels forever changed.",27 Jan 2022,91%,https://m.media-amazon.com/images/M/MV5BMjM2MTg0MDUtZTMwOS00MTk3LTkzZWQtOTQ0ODY4MTI3MTMxXkEyXkFqcGdeQXVyMTM1MTE1NDMx._V1_SX300.jpg,96 min,7.0
66e1ec409a310417bb9e48df,tt13651794,2023,May December,['Drama'],"['Natalie Portman', 'Chris Tenzis', 'Charles Melton']",['Todd Haynes'],"Twenty years after their notorious tabloid romance gripped the nation, a married couple buckles under pressure when an actress arrives to do research for a film about their past.",01 Dec 2023,91%,https://m.media-amazon.com/images/M/MV5BMTc1ODM5YjQtMmQzNS00Y2FkLWJhNTgtYTE5ZDY0NjQyNmRjXkEyXkFqcGdeQXVyMTY3ODE5NTY1._V1_SX300.jpg,117 min,6.8
66e1ec8e9a310417bb9e48ef,tt13751694,2023,Animal,"['Action', 'Crime', 'Drama']","['Ranbir Kapoor', 'Anil Kapoor', 'Bobby Deol']",['Sandeep Reddy Vanga'],The hardened son of a powerful industrialist returns home after years abroad and vows to take bloody revenge on those threatening his father's life.,01 Dec 2023,30%,https://m.media-amazon.com/images/M/MV5BNGViM2M4NmUtMmNkNy00MTQ5LTk5MDYtNmNhODAzODkwOTJlXkEyXkFqcGdeQXVyMTY1NDY4NTIw._V1_SX300.jpg,204 min,6.2
66e25b699a310417bb9e4948,tt3758542,2023,Ferrari,"['Biography', 'Drama', 'History']","['Adam Driver', 'Shailene Woodley', 'Giuseppe Festinese']",['Michael Mann'],"Set in the summer of 1957, with Enzo Ferrari's auto empire in crisis, the ex-racer turned entrepreneur pushes himself and his drivers to the edge as they launch into the Mille Miglia, a treacherous 1,000-mile race across Italy.",25 Dec 2023,72%,https://m.media-amazon.com/images/M/MV5BNTM0YTBlMjctZjJjZS00MDU4LTg5YmQtMDY5Y2FhMWZiMjQ2XkEyXkFqcGdeQXVyNzU0NzQxNTE@._V1_SX300.jpg,130 min,6.4
66e25b759a310417bb9e4966,tt21188080,2024,Lisa Frankenstein,"['Comedy', 'Horror', 'Romance']","['Kathryn Newton', 'Liza Soberano', 'Jenna Davis']",['Zelda Williams'],"A coming of RAGE love story about a teenager and her crush, who happens to be a corpse. After a set of horrific circumstances bring him back to life, the two embark on a journey to find love, happiness - and a few missing body parts.",09 Feb 2024,52%,https://m.media-amazon.com/images/M/MV5BNjJkZDExMGQtNGE2YS00YzJiLWJiNjEtNmYwZjIxZGMxNTZiXkEyXkFqcGdeQXVyMjkwOTAyMDU@._V1_SX300.jpg,101 min,6.1
66df536ca244d12c42351532,tt1649418,2022,The Gray Man,"['Action', 'Thriller']","['Ryan Gosling', 'Chris Evans', 'Ana de Armas']","['Joe Russo', 'Anthony Russo']","Count Gentry aka, Sierra Six a highly skilled former CIA Operative, was once the agency's best merchant of death. After his escape from prison, and recruitment by former handler Donald Fitzroy, Gentry is now on the run from the CIA with agent Lloyd Hansen hot on his trail. Aided by Agent Dani Miranda, Hansen will stop at nothing to bring Gentry down.",22 Jul 2022,45%,https://m.media-amazon.com/images/M/MV5BOWY4MmFiY2QtMzE1YS00NTg1LWIwOTQtYTI4ZGUzNWIxNTVmXkEyXkFqcGdeQXVyODk4OTc3MTY@._V1_SX300.jpg,122 min,6.5
66e25b7a9a310417bb9e4971,tt14230388,2023,Asteroid City,"['Comedy', 'Drama', 'Romance']","['Jason Schwartzman', 'Scarlett Johansson', 'Tom Hanks']",['Wes Anderson'],"Following a writer on his world famous fictional play about a grieving father who travels with his tech-obsessed family to small rural Asteroid City to compete in a junior stargazing event, only to have his world view disrupted fo...",23 Jun 2023,76%,https://m.media-amazon.com/images/M/MV5BNDJmMzY0ZGUtYWE1My00OWViLTg1NTctOWMwZWJlNDQzNGRiXkEyXkFqcGdeQXVyMjkwOTAyMDU@._V1_SX300.jpg,105 min,6.5
66e25b6c9a310417bb9e4953,tt14060094,2022,Blacklight,"['Action', 'Drama', 'Thriller']","['Liam Neeson', 'Aidan Quinn', 'Taylor John Smith']",['Mark Williams'],"Travis Block is a government operative coming to terms with his shadowy past. When he discovers a plot targeting U.S. citizens, Block finds himself in the crosshairs of the FBI director he once helped protect.",11 Feb 2022,11%,https://m.media-amazon.com/images/M/MV5BY2ViYmNhNzEtZDJhNS00YzM4LTkzZWItZDJiNzc5ZDExOWZmXkEyXkFqcGdeQXVyMDA4NzMyOA@@._V1_SX300.jpg,104 min,4.8
66e1ec3c9a310417bb9e48de,tt9682428,2024,Night Swim,"['Horror', 'Thriller']","['Wyatt Russell', 'Kerry Condon', 'Amélie Hoeferle']",['Bryce McGuire'],"A family moves into a new home, unaware that a dark secret from the house's past will unleash a malevolent force in the backyard pool.",05 Jan 2024,20%,https://m.media-amazon.com/images/M/MV5BOTFlZWVlNDctZDBiMS00MGY1LTk3MjUtNWUzZjY5NGZkM2M1XkEyXkFqcGdeQXVyMjY5ODI4NDk@._V1_SX300.jpg,98 min,4.7
66df5307a244d12c423514d8,tt2463208,2022,The Adam Project,"['Action', 'Adventure', 'Comedy']","['Ryan Reynolds', 'Walker Scobell', 'Mark Ruffalo']",['Shawn Levy'],"Adam Reed, age 12 and still grieving his father's sudden death the year before, walks into his garage one night to find a wounded pilot hiding there. This mysterious pilot turns out to be the older version of himself from the future, where time travel is in its infancy. He has risked everything to come back in time on a secret mission. Together they must embark on an adventure into the past to find their father, set things right, and save the world. As the three work together, both young and grown Adam come to terms with the loss of their father and have a chance to heal the wounds that have shaped them. Adding to the challenge of the mission, the two Adams discover that they really don't like each other much, and if they are to save the world, first they need to figure out how to get along.",11 Mar 2022,68%,https://m.media-amazon.com/images/M/MV5BOWM0YWMwMDQtMjE5NS00ZTIwLWE1NWEtODViMWZjMWI2OTU3XkEyXkFqcGdeQXVyMTEyMjM2NDc2._V1_SX300.jpg,106 min,6.7
66e25b719a310417bb9e495d,tt10698680,2022,K.G.F: Chapter 2,"['Action', 'Crime', 'Drama']","['Yash', 'Sanjay Dutt', 'Raveena Tandon']",['Prashanth Neel'],"The blood-soaked land of Kolar Gold Fields (KGF) has a new overlord now - Rocky, whose name strikes fear in the heart of his foes. His allies look up to Rocky as their savior, the government sees him as a threat to law and order; enemies are clamoring for revenge and conspiring for his downfall. Bloodier battles and darker days await as Rocky continues on his quest for unchallenged supremacy.",13 Apr 2022,47%,https://m.media-amazon.com/images/M/MV5BNjgzNDE5YTItNjM1Yi00OTk1LTk5ZjItYzAwNjM1ZWE3MDBiXkEyXkFqcGdeQXVyNjQ1MDcxNzM@._V1_SX300.jpg,166 min,8.2
66df52c8a244d12c4235149b,tt11286314,2021,Don't Look Up,"['Comedy', 'Drama', 'Sci-Fi']","['Leonardo DiCaprio', 'Jennifer Lawrence', 'Meryl Streep']",['Adam McKay'],"Kate Dibiasky (Jennifer Lawrence), an astronomy grad student, and her professor Dr. Randall Mindy (Leonardo DiCaprio) make an astounding discovery of a comet orbiting within the solar system. The problem - it's on a direct collision course with Earth. The other problem? No one really seems to care. Turns out warning mankind about a planet-killer the size of Mount Everest is an inconvenient fact to navigate. With the help of Dr. Oglethorpe (Rob Morgan), Kate and Randall embark on a media tour that takes them from the office of an indifferent President Orlean (Meryl Streep) and her sycophantic son and Chief of Staff, Jason (Jonah Hill), to the airwaves of The Daily Rip, an upbeat morning show hosted by Brie (Cate Blanchett) and Jack (Tyler Perry). With only six months until the comet makes impact, managing the 24-hour news cycle and gaining the attention of the social media obsessed public before it's too late proves shockingly comical - what will it take to get the world to just look up?.",24 Dec 2021,49/100,https://m.media-amazon.com/images/M/MV5BZjcwZjY3NjAtNzkxZS00NmFjLTg1OGYtODJmMThhY2UwMTc5XkEyXkFqcGdeQXVyODE5NzE3OTE@._V1_SX300.jpg,138 min,7.2
66e25b5e9a310417bb9e491a,tt25010142,2023,The Seven Deadly Sins: Grudge of Edinburgh Part 2,"['Animation', 'Action', 'Adventure']","['Mikako Komatsu', 'Kôki Uchiyama', 'Yûki Kaji']",['Bob Shirahata'],"Reunited with Lancelot for the first time since their tragic accident, Tristan must learn to conquer his inner demons in order to save his mother's life.",08 Aug 2023,,https://m.media-amazon.com/images/M/MV5BNmMwMWQyYWQtNmRjOC00NWE2LWJmY2MtY2NkMTcwZjM1MjU0XkEyXkFqcGdeQXVyMTEzMTI1Mjk3._V1_SX300.jpg,53 min,6.2
66e1ed1b9a310417bb9e4912,tt9100018,2023,Cobweb,"['Horror', 'Mystery', 'Thriller']","['Lizzy Caplan', 'Antony Starr', 'Cleopatra Coleman']",['Samuel Bodin'],"An eight-year-old boy tries to investigate the mysterious knocking sounds that are coming from inside the walls of his house, unveiling a dark secret that his sinister parents have kept hidden from him.",20 Oct 2023,74%,https://m.media-amazon.com/images/M/MV5BMWI2NjQ2NGYtNDMwYS00YzNlLWFjZTctNzQ5MTRiYzQyZjMzXkEyXkFqcGdeQXVyMTUzMTg2ODkz._V1_SX300.jpg,88 min,5.9
66e25b799a310417bb9e496f,tt28863512,2023,The Bad Guys: A Very Bad Holiday,"['Animation', 'Action', 'Adventure']","['Michael Godere', 'Ezekiel Ajeigbe', 'Raul Ceballos']","['Christo Stamboliev', 'Bret Haaland']","In this new adventure set before the events of the feature, there's nothing the Bad Guys love more than Christmas morning, because while everyone is home opening presents, it's the perfect time to execute their city-wide holiday h...",30 Nov 2023,,https://m.media-amazon.com/images/M/MV5BNjczZGE1NzItNjFjMS00M2I1LTliZWQtOWVmMWU5OWUxNjQwXkEyXkFqcGdeQXVyMTM3Mjc5MjA4._V1_SX300.jpg,22 min,5.1
66e60d73e2f69f45e61cb33e,tt28457138,2023,Kidnapped,['Mystery'],"['Hattie N. Smith', 'Nancy Powell', 'Caroline LeDuc']",['Richard J. Diaz'],"When Samantha Clemonte wants to go on a European vacation with friends, she is kidnapped and held for ransom instead. Who is behind the kidnapping and will they ever be brought to justice?",24 Jul 2023,,https://m.media-amazon.com/images/M/MV5BOWJjN2UwMzMtNzVkZi00NTRhLWE4NTEtZDZlZDFkYzQ1YTkyXkEyXkFqcGdeQXVyODAxMzMwMDI@._V1_SX300.jpg,79 min,N/A
66e60d73e2f69f45e61cb33f,tt8323668,2022,Jerry and Marge Go Large,"['Biography', 'Comedy', 'Drama']","['Bryan Cranston', 'Annette Bening', 'Rainn Wilson']",['David Frankel'],"Based on the true story about long-married couple Jerry and Marge Selbee, who win the lottery and use the money to revive their small town.",17 Jun 2022,67%,https://m.media-amazon.com/images/M/MV5BYWI5Y2ExNzUtZjQ1NS00ZjBlLWI1NDktZGYwNTRiNzI5ZjMxXkEyXkFqcGdeQXVyMTM1MTE1NDMx._V1_SX300.jpg,96 min,6.9
66e60d73e2f69f45e61cb340,tt15721650,2022,The Quintessential Quintuplets Movie,"['Animation', 'Comedy', 'Drama']","['Yoshitsugu Matsuoka', 'Kana Hanazawa', 'Ayana Taketatsu']",['Masato Jinbô'],"Teenage Tutor Fuutaro Uesugi has to finally choose between the 5 Nakano Sisters, who all have feelings for him, at the School's Upcoming Cultural Festival; the event that will lead to his Wedding to one of them in a Flash-Forward.",20 May 2022,92%,https://m.media-amazon.com/images/M/MV5BZGZlOTcxZWItZDA3Yy00ZDNhLTllZjktMTVhZjQzZDkxNTYxXkEyXkFqcGdeQXVyMzgxODM4NjM@._V1_SX300.jpg,136 min,7.2
66d7adc4c6dc28fe94973e34,tt7979580,2021,The Mitchells vs. the Machines,"['Animation', 'Adventure', 'Comedy']","['Abbi Jacobson', 'Danny McBride', 'Maya Rudolph']","['Michael Rianda', 'Jeff Rowe']","An animated action-comedy about an ordinary family who find themselves in the middle of their biggest family challenge yet...saving the world from the robot apocalypse. No big deal, right? It all starts when creative outsider Katie Mitchell is accepted into the film school of her dreams and is eager to leave home and find ""her people,"" when her nature-loving dad insists on having the whole family drive her to school and bond during one last totally-not-awkward-or-forced road trip. But just when the trip can't get any worse, the family suddenly finds itself in the middle of the robot uprising. Everything from smart phones, to roombas, to evil Furbys are employed to capture every human on the planet. Now it's up to the Mitchells, including upbeat mom Linda, quirky little brother Aaron, their squishy pug, Monchi, and two friendly, but simple-minded robots to save humanity.",30 Apr 2021,97%,https://m.media-amazon.com/images/M/MV5BMjdkZjNjNDItYzc4MC00NTkxLTk1MWEtY2UyZjY5MjUwNDNkXkEyXkFqcGdeQXVyMTA1OTcyNDQ4._V1_SX300.jpg,114 min,7.6
66e25b819a310417bb9e4991,tt11358390,2023,Renfield,"['Action', 'Comedy', 'Fantasy']","['Nicholas Hoult', 'Nicolas Cage', 'Awkwafina']",['Chris McKay'],"Renfield, Dracula's tortured henchman, is forced to capture prey for his master and do his every bidding. But now, after centuries of servitude, Renfield is ready to see if there is a life outside his boss's shadow.",14 Apr 2023,58%,https://m.media-amazon.com/images/M/MV5BNWFlY2RhZWYtYWNmYS00MmQyLThiYTctYmFmMDVhNjhlMTI3XkEyXkFqcGdeQXVyNTA3MTU2MjE@._V1_SX300.jpg,93 min,6.4
66e1eb709a310417bb9e48b6,tt6902332,2021,The Marksman,"['Action', 'Drama', 'Thriller']","['Katheryn Winnick', 'Liam Neeson', 'Teresa Ruiz']",['Robert Lorenz'],"Leading a lonely, almost hand-to-mouth existence, Jim Hanson, a financially hard-pressed rancher on the Arizona-Mexico border and decorated former scout sniper for the U.S. Marine Corps, is on the ropes. Still reeling from the loss of a dear one, Jim spends his days with his inseparable companion, Jackson, the sheepdog, unbeknownst to him that his already complicated life is about to take an unexpected turn. Now, as desperate Rosa entrusts Jim with the life of her young son, Miguel, an inadvertent, all-out war with the brutally violent henchmen of the murderous cartel leader, Mauricio, breaks out. Suddenly, Hanson has one more problem to deal with, and the road to Chicago, where Miguel's relatives are, is long and fraught with danger. Can the grizzled protector carry out one last mission?",15 Jan 2021,38%,https://m.media-amazon.com/images/M/MV5BODdlNThhMTUtNmU1OS00ZjM3LWE1ZjMtOWViN2RhYWRiZTg5XkEyXkFqcGdeQXVyMDA4NzMyOA@@._V1_SX300.jpg,108 min,5.7
66e25b5e9a310417bb9e491c,tt2183014,2023,Love at First Sight,"['Drama', 'Romance']","['Haley Lu Richardson', 'Ben Hardy', 'Rob Delaney']",['Vanessa Caswill'],"When a 17 year old girl, Hadley, misses her flight from JFK to London, she meets a British boy, Oliver, who happens to be in her row on the airplane. When Hadley and Oliver lose each other, when they get to London, will fare bring them together or will they be torn apart forever?",15 Sep 2023,74%,https://m.media-amazon.com/images/M/MV5BOTY0M2EyNGUtYmZiYi00MTVlLThkMWMtMjNkZjg5Nzg2NjRmXkEyXkFqcGc@._V1_SX300.jpg,91 min,6.8
66e60d73e2f69f45e61cb341,tt15830702,2022,Sword Art Online the Movie: Progressive - Scherzo of Deep Night,"['Animation', 'Action', 'Adventure']","['Haruka Tomatsu', 'Yoshitsugu Matsuoka', 'Shiori Izawa']","['Ayako Kouno', 'Masakazu Ohara']","Two months have passed since the deadly game began, and Kirito and Asuna continue to make progress. They stop for treasure, but then they must face Asuna's least favorite monster.",03 Feb 2023,42%,https://m.media-amazon.com/images/M/MV5BNzExZjlkODEtNTNiNC00OGE4LWI0YTEtNzVjODU5NzFjN2FjXkEyXkFqcGdeQXVyMTEwMjgyMzIz._V1_SX300.jpg,101 min,6.7
