_id,id,year,title,genres,actors,director,plot,release_date,rotten_tomatoes,poster,runtime,imdb_rating
66d5a78cb98715a0131a8a55,tt6263850,2024,Deadpool & Wolverine,"['Action', 'Adventure', 'Comedy']","['Ryan Reynolds', 'Hugh Jackman', 'Emma Corrin']",['Shawn Levy'],"Deadpool is offered a place in the Marvel Cinematic Universe by the Time Variance Authority, but instead recruits a variant of Wolverine to save his universe from extinction.",26 Jul 2024,78%,https://m.media-amazon.com/images/M/MV5BNzRiMjg0MzUtNTQ1Mi00Y2Q5LWEwM2MtMzUwZDU5NmVjN2NkXkEyXkFqcGc@._V1_SX300.jpg,128 min,8.1
66d5a8f4b98715a0131a8a97,tt4978420,2024,Borderlands,"['Action', 'Adventure', 'Comedy']","['Cate Blanchett', 'Kevin Hart', 'Edgar Ramírez']",['Eli Roth'],"Lilith, an infamous outlaw with a mysterious past, reluctantly returns to her home planet of Pandora to find the missing daughter of the universe's most powerful S.O.B., Atlas. Lilith forms an alliance with an unexpected team - Roland, a former elite mercenary, now desperate for redemption; Tiny Tina, a feral pre-teen demolitionist; Krieg, Tina's musclebound, rhetorically challenged protector; Tannis, the scientist with a tenuous grip on sanity; and Claptrap, a persistently wiseass robot. These unlikely heroes must battle alien monsters and dangerous bandits to find and protect the missing girl, who may hold the key to unimaginable power. The fate of the universe could be in their hands - but they'll be fighting for something more: each other.",09 Aug 2024,8%,https://m.media-amazon.com/images/M/MV5BOWZmOTM5YmMtNjliMi00OGRkLWIwNGUtNDI2NTE3NzZmMDdmXkEyXkFqcGdeQXVyMTUzMTg2ODkz._V1_SX300.jpg,102 min,4.4
66d5cd4c66b2f0d84bfd54cd,tt11301886,2024,Rebel Ridge,"['Action', 'Crime', 'Drama']","['Aaron Pierre', 'Don Johnson', 'AnnaSophia Robb']",['Jeremy Saulnier'],An ex-Marine grapples his way through a web of small-town corruption when an attempt to post bail for his cousin escalates into a violent standoff with the local police chief.,06 Sep 2024,,https://m.media-amazon.com/images/M/MV5BNjFjNThlNjktZmYyOC00ZDYwLTg2ZDItZDk4MDhmYTBmMmIzXkEyXkFqcGc@._V1_SX300.jpg,131 min,N/A
66d5a78fb98715a0131a8a56,tt22022452,2024,Inside Out 2,"['Animation', 'Adventure', 'Comedy']","['Amy Poehler', 'Maya Hawke', 'Kensington Tallman']",['Kelsey Mann'],"A sequel that features Riley entering puberty and experiencing brand new, more complex emotions as a result. As Riley tries to adapt to her teenage years, her old emotions try to adapt to the possibility of being replaced.",14 Jun 2024,91%,https://m.media-amazon.com/images/M/MV5BYTc1MDQ3NjAtOWEzMi00YzE1LWI2OWUtNjQ0OWJkMzI3MDhmXkEyXkFqcGdeQXVyMDM2NDM2MQ@@._V1_SX300.jpg,96 min,7.8
66d5a82fb98715a0131a8a77,tt2049403,2024,Beetlejuice Beetlejuice,"['Comedy', 'Fantasy', 'Horror']","['Michael Keaton', 'Winona Ryder', ""Catherine O'Hara""]",['Tim Burton'],"From critically acclaimed filmmaker and screenwriter, Tim Burton presents the long-awaited sequel to the Halloween classic. Keaton's action-packed comedic demon returns to the silver screen for more mischief than ever before. When the Maitland house EXPLODES, so does the fun, so buckle up. The original cast and crew plus new additions return when Beetlejuice is found homeless in the netherworld. He takes it upon himself to travel back to the mortal world seeking comfort, only to find the Maitland house has blown up due to a gas leak. Leaving our beloved characters without a humble home to share the love. In search of guidance, the crew travels down to the Netherworld only to find there's a new sheriff in these parts, The Jersey Devil (Will Arnett). Through a surprising turn of events, the self-known ladies man, Beetlejuice learns that the Jersey Devil is his long-lost son through one of his numerous love affairs. Lydia Deetz (Winona Ryder) is wood by the enchanting Jersey Devil, despite being married to a struggling real estate agent (David Harbour). Through kooky scenarios and ecstatic characters, the fun near stops. Though entertaining it is also a heart-wrenching tale that shows Beetlejuice is just another man trying to find his way in the world. The story also progresses the idea that a family is never truly ideal. The story continues when you say the release date three times unbroken. Release date TBD.",06 Sep 2024,,https://m.media-amazon.com/images/M/MV5BYmRlYzE3ZTYtNjIyZi00MWYyLWEzZDItOWI5NzM1Yjc0NmI5XkEyXkFqcGc@._V1_SX300.jpg,104 min,N/A
66d5a791b98715a0131a8a57,tt7510222,2024,Despicable Me 4,"['Animation', 'Adventure', 'Comedy']","['Steve Carell', 'Kristen Wiig', 'Pierre Coffin']","['Chris Renaud', 'Patrick Delage']","Gru, Lucy, Margo, Edith, and Agnes welcome a new member to the family, Gru Jr., who is intent on tormenting his dad. Gru faces a new nemesis in Maxime Le Mal and his girlfriend Valentina, and the family is forced to go on the run.",03 Jul 2024,56%,https://m.media-amazon.com/images/M/MV5BOTk4MjFhZTMtOWIxOS00YzE2LThkZGEtMzg0MDAyMmFiZmU1XkEyXkFqcGdeQXVyMTY3ODkyNDkz._V1_SX300.jpg,94 min,6.2
66d5a797b98715a0131a8a59,tt4919268,2024,Bad Boys: Ride or Die,"['Action', 'Adventure', 'Comedy']","['Will Smith', 'Martin Lawrence', 'Vanessa Hudgens']","['Adil El Arbi', 'Bilall Fallah']","When their late police captain gets linked to drug cartels, wisecracking Miami cops Mike Lowrey and Marcus Burnett embark on a dangerous mission to clear his name.",07 Jun 2024,65%,https://m.media-amazon.com/images/M/MV5BY2U5YmQ3YjgtM2I2OC00YmM5LTkyM2MtN2I5Zjg2MDE0ODkwXkEyXkFqcGdeQXVyMDM2NDM2MQ@@._V1_SX300.jpg,115 min,6.7
66d5a978b98715a0131a8ab2,tt1121948,2024,The Killer,['Action'],"['Nathalie Emmanuel', 'Omar Sy', 'Sam Worthington']",['John Woo'],An assassin tries to make amends in an effort to restore the sight of a beautiful young singer.,23 Aug 2024,85%,https://m.media-amazon.com/images/M/MV5BYjQ1MWNkNGQtMzI2ZC00OTJiLTljZDMtZTUxNDljNTI1MTk0XkEyXkFqcGc@._V1_SX300.jpg,126 min,5.7
66d5a7f2b98715a0131a8a6f,tt20316748,2024,Twilight of the Warriors: Walled In,"['Action', 'Crime', 'Thriller']","['Louis Koo', 'Sammo Kam-Bo Hung', 'Richie Jen']",['Soi Cheang'],"Follows troubled youth Chan Lok-kwun as he accidentally enters the Walled City, discovers the order amidst its chaos, and learns important life lessons along the way.",01 May 2024,90%,https://m.media-amazon.com/images/M/MV5BYTIzODllOTItMmQ3ZC00Yzg0LTg3NjgtZjBiODNmYzViYTE0XkEyXkFqcGc@._V1_SX300.jpg,126 min,7.2
66d5a794b98715a0131a8a58,tt12584954,2024,Twisters,"['Action', 'Adventure', 'Thriller']","['Daisy Edgar-Jones', 'Glen Powell', 'Anthony Ramos']",['Lee Isaac Chung'],"Kate Carter, a retired tornado-chaser and meteorologist, is persuaded to return to Oklahoma to work with a new team and new technologies.",19 Jul 2024,75%,https://m.media-amazon.com/images/M/MV5BZTQ0YjZhNzMtMzMwYi00YTQwLTlhYTgtNDBlZjRhYjJmMzJmXkEyXkFqcGc@._V1_SX300.jpg,122 min,6.8
66d5a7abb98715a0131a8a5f,tt10655524,2024,It Ends with Us,"['Drama', 'Romance']","['Blake Lively', 'Justin Baldoni', 'Jenny Slate']",['Justin Baldoni'],"Adapted from the Colleen Hoover novel, Lily overcomes a traumatic childhood to embark on a new life. A chance meeting with a neurosurgeon sparks a connection but Lily begins to see sides of him that remind her of her parents' rela...",09 Aug 2024,59%,https://m.media-amazon.com/images/M/MV5BYzM2NGMzNGQtZjNhMi00MTVkLTg2ZGQtN2M4OTllYzU1Y2Y0XkEyXkFqcGc@._V1_SX300.jpg,130 min,7.1
66d5a7a7b98715a0131a8a5e,tt18412256,2024,Alien: Romulus,"['Horror', 'Sci-Fi', 'Thriller']","['Cailee Spaeny', 'David Jonsson', 'Archie Renaux']",['Fede Alvarez'],"While scavenging the deep ends of a derelict space station, a group of young space colonists come face to face with the most terrifying life form in the universe.",16 Aug 2024,82%,https://m.media-amazon.com/images/M/MV5BMDU0NjcwOGQtNjNjOS00NzQ3LWIwM2YtYWVmODZjMzQzN2ExXkEyXkFqcGc@._V1_SX300.jpg,119 min,7.5
66d5a7f9b98715a0131a8a70,tt26753003,2024,Trap,"['Crime', 'Horror', 'Mystery']","['Josh Hartnett', 'Ariel Donoghue', 'Saleka Shyamalan']",['M. Night Shyamalan'],A father and his teen daughter attend a pop concert only to realize they've entered the center of a dark and sinister event.,02 Aug 2024,50%,https://m.media-amazon.com/images/M/MV5BMzJiN2UyZjgtMjQ3MS00MDhhLTg5ZDItZmVjMTU3MTcwNzE4XkEyXkFqcGc@._V1_SX300.jpg,105 min,6.2
66e60d60e2f69f45e61cb316,tt30959158,2024,Kill Me If You Dare,"['Comedy', 'Romance']","['Weronika Ksiazkiewicz', 'Mateusz Banasiuk', 'Agnieszka Wiedlocha']",['Filip Zylber'],A winning lottery ticket has grave consequences for a married couple when they start hatching plans to kill each other for the prize money.,13 Feb 2024,0%,https://m.media-amazon.com/images/M/MV5BMmVhMDdkNDMtOGM4NS00Y2I0LWE2ZjMtN2E4NGJlOTU5ZWNiXkEyXkFqcGdeQXVyNDA2MzY0MzY@._V1_SX300.jpg,94 min,4.6
66d5a7bab98715a0131a8a64,tt5779228,2024,The Garfield Movie,"['Animation', 'Adventure', 'Comedy']","['Chris Pratt', 'Samuel L. Jackson', 'Hannah Waddingham']",['Mark Dindal'],"After Garfield's unexpected reunion with his long-lost father, ragged alley cat Vic, he and his canine friend Odie are forced from their perfectly pampered lives to join Vic on a risky heist.",24 May 2024,36%,https://m.media-amazon.com/images/M/MV5BZDdlNTIwNjYtNzVhNS00MGVmLTk1ZGYtZmZiMjhiMmQ1ZjkwXkEyXkFqcGdeQXVyMTY3ODkyNDkz._V1_SX300.jpg,101 min,5.7
66d5a7b7b98715a0131a8a63,tt23063732,2024,Saving Bikini Bottom: The Sandy Cheeks Movie,"['Animation', 'Adventure', 'Comedy']","['Carolyn Lawrence', 'Tom Kenny', 'Clancy Brown']",['Liza Johnson'],"When Bikini Bottom is suddenly scooped out of the ocean, Sandy Cheeks and SpongeBob journey to Sandy's home state of Texas, where they meet Sandy's family and must save Bikini Bottom from the hands of an evil CEO.",02 Aug 2024,40%,https://m.media-amazon.com/images/M/MV5BYTFmNDU1YjItZThmYi00NjM3LTk5OGEtODgyMDQ3ODFiYjZhXkEyXkFqcGc@._V1_SX300.jpg,82 min,3.7
66d5a7a1b98715a0131a8a5c,tt12610390,2024,The Union,"['Action', 'Comedy', 'Thriller']","['Mark Wahlberg', 'Halle Berry', 'J.K. Simmons']",['Julian Farino'],"Mike, a down-to earth construction worker, is thrust into the world of super spies and secret agents when his high school sweetheart, Roxanne, recruits him on a high-stakes U.S. intelligence mission.",16 Aug 2024,50%,https://m.media-amazon.com/images/M/MV5BY2I0YmNiNmEtNWI2My00NDU5LWIwZWItNWNkNjFmYWJjNTMxXkEyXkFqcGc@._V1_SX300.jpg,107 min,5.5
66db7557353d0cebc2cd85f1,tt4196566,2024,The Deliverance,"['Horror', 'Thriller']","['Andra Day', 'Glenn Close', 'Anthony B. Jenkins']",['Lee Daniels'],"A family living in a home in Indiana discover strange, demonic occurrences that convince them and the community that the house is a portal to hell.",30 Aug 2024,,https://m.media-amazon.com/images/M/MV5BNWI2ZWFkNTAtYjA0NS00NzZkLWE1NzMtNGRkMmY2MzEwZWRkXkEyXkFqcGc@._V1_SX300.jpg,N/A,N/A
66d5a7b4b98715a0131a8a62,tt13433802,2024,A Quiet Place: Day One,"['Drama', 'Horror', 'Sci-Fi']","[""Lupita Nyong'o"", 'Joseph Quinn', 'Alex Wolff']",['Michael Sarnoski'],A young woman named Sam finds herself trapped in New York City during the early stages of an invasion by alien creatures with ultra-sensitive hearing.,28 Jun 2024,86%,https://m.media-amazon.com/images/M/MV5BNGZmODU3ZDEtMjQwZC00NTA5LThmNWYtYzk5MmY5ZmM4NGIxXkEyXkFqcGdeQXVyMDM2NDM2MQ@@._V1_SX300.jpg,99 min,6.4
66d5a799b98715a0131a8a5a,tt23468450,2024,Longlegs,"['Crime', 'Horror', 'Thriller']","['Maika Monroe', 'Nicolas Cage', 'Blair Underwood']",['Osgood Perkins'],"In pursuit of a serial killer, an FBI agent uncovers a series of occult clues that she must solve to end his terrifying killing spree.",12 Jul 2024,86%,https://m.media-amazon.com/images/M/MV5BMmVkZWY2ODEtYTMyYy00MDg2LWFkMGUtMjYwOTBhOGViODQzXkEyXkFqcGdeQXVyMTkxNjUyNQ@@._V1_SX300.jpg,101 min,7.1
66d5a7b1b98715a0131a8a61,tt23173980,2024,Darkness of Man,"['Action', 'Crime', 'Thriller']","['Jean-Claude Van Damme', 'Kristanna Loken', 'Emerson Min']",['James Cullen Bressack'],"Interpol operative Russell Hatch witnesses the death of an informant when a seemingly routine raid goes wrong. Years later, he finds himself protecting the informant's son from a group of merciless gangs involved in an all-out tur...",21 May 2024,70%,https://m.media-amazon.com/images/M/MV5BMDNlODgwMDYtOTU2Ni00M2JiLWFkN2QtYzZjY2NjNGVlYmJmXkEyXkFqcGdeQXVyMzQwMTY2Nzk@._V1_SX300.jpg,109 min,4.4
66d5a7a6b98715a0131a8a5d,tt26940324,2024,Jackpot!,"['Action', 'Comedy']","['John Cena', 'Awkwafina', 'Simu Liu']",['Paul Feig'],"In the near future, a 'Grand Lottery' has been newly established in California - the catch: kill the winner before sundown to legally claim their multi-billion dollar jackpot.",15 Aug 2024,38%,https://m.media-amazon.com/images/M/MV5BMmQ2ZGU3ODYtNzA0Yi00NDlhLWIxNzYtM2E2Y2FhOGNjZjIyXkEyXkFqcGc@._V1_SX300.jpg,106 min,5.8
66d5a8aab98715a0131a8a8a,tt21909764,2023,My Fault,"['Drama', 'Romance']","['Nicole Wallace', 'Gabriel Guevara', 'Marta Hazas']",['Domingo González'],"Noah has to leave her town, boyfriend and friends behind and move into the mansion of her mother's new rich husband. There she meets Nick, her new stepbrother. They fall madly in love in secret.",08 Jun 2023,0%,https://m.media-amazon.com/images/M/MV5BYTRmMWQxZGEtZTZiMS00ZTRiLWIyYmMtMzNmMmRjZjYyNGUyXkEyXkFqcGdeQXVyMTUzOTcyODA5._V1_SX300.jpg,117 min,6.2
66d5a7e3b98715a0131a8a6b,tt11389872,2024,Kingdom of the Planet of the Apes,"['Action', 'Adventure', 'Drama']","['Owen Teague', 'Freya Allan', 'Kevin Durand']",['Wes Ball'],"Many years after the reign of Caesar, a young ape goes on a journey that will lead him to question everything he's been taught about the past and make choices that will define a future for apes and humans alike.",10 May 2024,80%,https://m.media-amazon.com/images/M/MV5BZGI4NTEwNTAtZDcwMi00MDkxLTg1OGYtNTZmMzE3ZDljNzVlXkEyXkFqcGdeQXVyMTEyMjM2NDc2._V1_SX300.jpg,145 min,7.0
66d5a7c5b98715a0131a8a66,tt27682129,2024,Prey,"['Action', 'Thriller']","['Ryan Phillippe', 'Emile Hirsch', 'Mena Suvari']",['Mukunda Michael Dewil'],A young couple is compelled to leave their Christian missionary station in the Kalahari Desert after being threatened with death by an extremist militant gang. After crashing their aircraft they must battle man and beast for their...,15 Mar 2024,,https://m.media-amazon.com/images/M/MV5BMGEyMjcwM2ItZjBiMi00ODhjLTgwNmUtNjMwYzE3N2UxYzUwXkEyXkFqcGdeQXVyMTkxNjUyNQ@@._V1_SX300.jpg,86 min,3.8
66d5a857b98715a0131a8a7f,tt1609486,2024,Harold and the Purple Crayon,"['Animation', 'Adventure', 'Comedy']","['Zachary Levi', 'Lil Rel Howery', 'Benjamin Bottani']",['Carlos Saldanha'],"Inside of his book, adventurous Harold can make anything come to life simply by drawing it. After he grows up and draws himself off the book's pages and into the physical world, Harold finds he has a lot to learn about real life.",02 Aug 2024,30%,https://m.media-amazon.com/images/M/MV5BZGE3MmYxOTgtMGY1Ni00ZWQ4LTlhNjAtMzcxYjIzMjcwN2U1XkEyXkFqcGc@._V1_SX300.jpg,89 min,5.8
66d5a7e7b98715a0131a8a6d,tt12037194,2024,Furiosa: A Mad Max Saga,"['Action', 'Adventure', 'Sci-Fi']","['Anya Taylor-Joy', 'Chris Hemsworth', 'Tom Burke']",['George Miller'],The origin story of renegade warrior Furiosa before her encounter and teamup with Mad Max.,24 May 2024,90%,https://m.media-amazon.com/images/M/MV5BNWRlZTJhNGMtOWIyOS00YjRkLWExNjgtNDEwOTY1NGYxYmEwXkEyXkFqcGc@._V1_SX300.jpg,148 min,7.6
66d5a839b98715a0131a8a7a,tt20202136,2024,Descendants: The Rise of Red,"['Action', 'Adventure', 'Family']","['Kylie Cantrall', 'Malia Baker', 'Dara Reneé']",['Jennifer Phang'],"Follows Red, daughter of the Queen of Hearts, and Chloe, daughter of Cinderella, as they team up to save Auradon by traveling back in time using the White Rabbit's pocket watch, to stop an event that would cause grave consequences.",12 Jul 2024,50%,https://m.media-amazon.com/images/M/MV5BNGUwYTYxMjItMDZkMi00MTIxLThjYWItOGRkN2YxMWJiY2Q4XkEyXkFqcGc@._V1_SX300.jpg,91 min,4.7
66d5a8b3b98715a0131a8a8b,tt8550054,2021,Pleasure,['Drama'],"['Sofia Kappel', 'Zelda Morrison', 'Evelyn Claire']",['Ninja Thyberg'],"Ninja Thyberg's debut feature PLEASURE is a journey into the American porn industry and follows 19-year-old Bella from Sweden, who arrives in Los Angeles with the dream of becoming the next big porn star. The film is raw but offers both a human and humorous portrayal of a male-dominated world seen from a female perspective.",08 Oct 2021,88%,https://m.media-amazon.com/images/M/MV5BNmU3ZTJjMTEtYzc2Ny00YjVhLTkyYmQtZTFhYWY0N2MxMzkxXkEyXkFqcGdeQXVyMTM1MTE1NDMx._V1_SX300.jpg,109 min,6.3
66d5a83bb98715a0131a8a7b,tt17279496,2024,Civil War,"['Action', 'Adventure', 'Thriller']","['Kirsten Dunst', 'Wagner Moura', 'Cailee Spaeny']",['Alex Garland'],"A journey across a dystopian future America, following a team of military-embedded journalists as they race against time to reach DC before rebel factions descend upon the White House.",12 Apr 2024,81%,https://m.media-amazon.com/images/M/MV5BYTYyODhlODktYjUzNC00NjUyLWI1MzYtNmI0MTY3YTUxYjY2XkEyXkFqcGdeQXVyMTkxNjUyNQ@@._V1_SX300.jpg,109 min,7.1
66d5a843b98715a0131a8a7c,tt14539740,2024,Godzilla x Kong: The New Empire,"['Action', 'Adventure', 'Fantasy']","['Rebecca Hall', 'Brian Tyree Henry', 'Dan Stevens']",['Adam Wingard'],"Two ancient titans, Godzilla and Kong, clash in an epic battle as humans unravel their intertwined origins and connection to Skull Island's mysteries.",29 Mar 2024,54%,https://m.media-amazon.com/images/M/MV5BY2QwOGE2NGQtMWQwNi00M2IzLThlNWItYWMzNGQ5YWNiZDA4XkEyXkFqcGdeQXVyNTE1NjY5Mg@@._V1_SX300.jpg,115 min,6.1
66d5a7e1b98715a0131a8a6a,tt21096576,2024,One Fast Move,['Action'],"['K.J. Apa', 'Eric Dane', 'Maia Reficco']",['Kelly Blatz'],"A young man seeks out his estranged father to pursue his dream of becoming a professional motorcycle racer. With help from his love interest and a motorcycle shop owner, he begins to break down the walls his father's absence had c...",08 Aug 2024,40%,https://m.media-amazon.com/images/M/MV5BZmU1ZGMyYWQtNjg4Yi00ZGJlLWEyOGYtZTExZTNkMjA5YTNjXkEyXkFqcGc@._V1_SX300.jpg,118 min,4.8
66d5a865b98715a0131a8a82,tt21692408,2024,Kung Fu Panda 4,"['Animation', 'Action', 'Adventure']","['Jack Black', 'Awkwafina', 'Viola Davis']","['Mike Mitchell', 'Stephanie Stine']","After Po is tapped to become the Spiritual Leader of the Valley of Peace, he needs to find and train a new Dragon Warrior, while a wicked sorceress plans to re-summon all the master villains whom Po has vanquished to the spirit re...",08 Mar 2024,71%,https://m.media-amazon.com/images/M/MV5BZDY0YzI0OTctYjVhYy00MTVhLWE0NTgtYTRmYTBmOTE3YTViXkEyXkFqcGdeQXVyMTUzMTg2ODkz._V1_SX300.jpg,94 min,6.3
66d5a7d6b98715a0131a8a68,tt19319352,2023,Mayhem!,"['Action', 'Thriller']","['Nassim Lyes', 'Loryn Nounay', 'Olivier Gourmet']",['Xavier Gens'],"A model prisoner's leave ends in tragedy when his past resurfaces, forcing him to flee. He starts over in Thailand, until a local criminal coerces him back into crime. After this man attacks his family, he vows revenge.",28 Jun 2023,81%,https://m.media-amazon.com/images/M/MV5BOTM5YmU0OWMtZDAwZi00NmM3LWE4N2MtNGFkYTY1OTYzYWY5XkEyXkFqcGdeQXVyNDM1ODc2NzE@._V1_SX300.jpg,99 min,6.4
66d5a7eeb98715a0131a8a6e,tt24169886,2024,The Instigators,"['Action', 'Comedy', 'Crime']","['Matt Damon', 'Casey Affleck', 'Hong Chau']",['Doug Liman'],Follows two robbers who must go on the run with the help of one of their therapists after a theft doesn't go as planned.,09 Aug 2024,41%,https://m.media-amazon.com/images/M/MV5BYTExNzBhOTAtOGIyYy00MzY5LWFjOWYtZDE2NDE0ZmI3Y2Q3XkEyXkFqcGc@._V1_SX300.jpg,101 min,6.7
66e60d61e2f69f45e61cb317,tt30150917,2024,Justice League: Crisis on Infinite Earths - Part Three,"['Animation', 'Action', 'Adventure']","['Jensen Ackles', 'Gideon Adlon', 'Ike Amadi']",['Jeff Wamester'],"Trapped in a pocket universe, surviving Earths face annihilation by the Anti-Monitor. Time shatters, bringing past heroes to aid Justice League against the epitome of evil. Their sacrifice may lead to victory.",16 Jul 2024,20%,https://m.media-amazon.com/images/M/MV5BNzM2MWM1M2UtZjk2NS00MGZkLTkxZmUtZjZiMjRjYWEwNzRkXkEyXkFqcGdeQXVyMTgxMjAyNDQ5._V1_SX300.jpg,94 min,6.0
66d5a892b98715a0131a8a87,tt5177120,2024,The Ministry of Ungentlemanly Warfare,"['Action', 'Comedy', 'War']","['Henry Cavill', 'Alan Ritchson', 'Alex Pettyfer']",['Guy Ritchie'],The British military recruits a small group of highly skilled soldiers to strike against German forces behind enemy lines during World War II.,19 Apr 2024,69%,https://m.media-amazon.com/images/M/MV5BOWI5YTlkNTktOTJlMC00MmYyLThkNzQtYmExOGZkZDE1ZjgwXkEyXkFqcGdeQXVyMjM4NTM5NDY@._V1_SX300.jpg,122 min,6.8
66d5a807b98715a0131a8a71,tt22863968,2024,Something in the Water,['Thriller'],"['Hiftu Quasem', 'Natalie Mitson', 'Tashani Bent']",['Hayley Easton Street'],A group of five friends must fight for their lives in open water after a dream wedding turns into a nightmare.,03 May 2024,47%,https://m.media-amazon.com/images/M/MV5BMGU3MjQ2ZmYtYmFjMC00NzEyLWJkNzYtZmRiOTA5NjRiMTlhXkEyXkFqcGdeQXVyMTYxNTA3NjEx._V1_SX300.jpg,86 min,4.2
66d5a920b98715a0131a8aa3,tt5433140,2023,Fast X,"['Action', 'Adventure', 'Crime']","['Vin Diesel', 'Michelle Rodriguez', 'Jason Statham']",['Louis Leterrier'],Dom Toretto and his family are targeted by the vengeful son of drug kingpin Hernan Reyes.,19 May 2023,56%,https://m.media-amazon.com/images/M/MV5BNzZmOTU1ZTEtYzVhNi00NzQxLWI5ZjAtNWNhNjEwY2E3YmZjXkEyXkFqcGdeQXVyODk4OTc3MTY@._V1_SX300.jpg,141 min,5.7
66d5a8d6b98715a0131a8a8f,tt6495056,2023,Migration,"['Animation', 'Adventure', 'Comedy']","['Kumail Nanjiani', 'Tresi Gazal', 'Elizabeth Banks']","['Benjamin Renner', 'Guylo Homsy']",A family of ducks try to convince their overprotective father to go on the vacation of a lifetime.,22 Dec 2023,73%,https://m.media-amazon.com/images/M/MV5BYTIxZDM5YWItM2Y1My00ODg5LTkzNjAtMWFlZTNlODg0MzEyXkEyXkFqcGdeQXVyMTA5ODEyNTc5._V1_SX300.jpg,83 min,6.6
66d5a97cb98715a0131a8ab3,tt5090568,2023,Transformers: Rise of the Beasts,"['Action', 'Adventure', 'Sci-Fi']","['Anthony Ramos', 'Dominique Fishback', 'Luna Lauren Velez']",['Steven Caple Jr.'],"Set in the 1990s, Transformers: Rise of the Beasts will take audiences on an action-packed, globetrotting adventure as the Maximals, Predacons, and Terrorcons join the battle between the Autobots and Decepticons on Earth. Noah, a sharp young guy from Brooklyn, and Elena, an ambitious, talented artifact researcher, are swept up in the conflict as Optimus Prime and the Autobots face a terrifying new nemesis bent on their destruction named Scourge.",09 Jun 2023,52%,https://m.media-amazon.com/images/M/MV5BZTNiNDA4NmMtNTExNi00YmViLWJkMDAtMDAxNmRjY2I2NDVjXkEyXkFqcGdeQXVyMDM2NDM2MQ@@._V1_SX300.jpg,127 min,6.0
66d5a818b98715a0131a8a73,tt26470109,2024,Oddity,"['Horror', 'Thriller']","['Carolyn Bracken', 'Johnny French', 'Steve Wall']",['Damian Mc Carthy'],A psychic medium attempts to uncover the truth behind her sister's murder at the site of the crime.,19 Jul 2024,96%,https://m.media-amazon.com/images/M/MV5BMWU5Yjc0N2MtZjhlYS00MTM3LWI5YWUtZDg5MzcxZjEyZWJmXkEyXkFqcGc@._V1_SX300.jpg,98 min,6.8
66db7561353d0cebc2cd85f4,tt1340094,2024,The Crow,"['Action', 'Crime', 'Fantasy']","['Bill Skarsgård', 'FKA twigs', 'Danny Huston']",['Rupert Sanders'],"In this modern re-imagining of the 1994 cult classic, ""The Crow,"" soulmates Eric and Shelly are brutally murdered. Given a chance to save her, Eric must sacrifice himself and traverse the worlds of the living and the dead, seeking...",23 Aug 2024,,https://m.media-amazon.com/images/M/MV5BMjEyOWJjMWQtZTY4Yi00ZjYyLWJhNDktZmRkNzEwMjlhZjQ3XkEyXkFqcGc@._V1_SX300.jpg,111 min,N/A
66d5a8edb98715a0131a8a94,tt12930350,2024,My Spy The Eternal City,"['Action', 'Comedy']","['Dave Bautista', 'Chloe Coleman', 'Kristen Schaal']",['Peter Segal'],"JJ, a veteran CIA agent, reunites with his protégé Sophie, in order to prevent a catastrophic nuclear scheme threatening Vatican City, which disrupts a high school choir trip to Italy.",18 Jul 2024,22%,https://m.media-amazon.com/images/M/MV5BMjVhMTBlN2QtMWJmOS00OTliLWEwZTUtZjI3NWM2NjdmZjI3XkEyXkFqcGc@._V1_SX300.jpg,112 min,5.6
66d5a88eb98715a0131a8a86,tt23778968,2024,Thelma,"['Action', 'Comedy']","['June Squibb', 'Fred Hechinger', 'Richard Roundtree']",['Josh Margolin'],"When 93-year-old Thelma Post gets duped by a phone scammer pretending to be her grandson, she sets out on a treacherous quest across the city to reclaim what was taken from her.",21 Jun 2024,99%,https://m.media-amazon.com/images/M/MV5BM2Q2ZmY1ZmYtYWJlMS00MDJhLTkyYmUtMmU4MTQ5OThlYjQ2XkEyXkFqcGdeQXVyMTkxNjUyNQ@@._V1_SX300.jpg,98 min,7.1
66d5a92db98715a0131a8aa6,tt15239678,2024,Dune: Part Two,"['Action', 'Adventure', 'Drama']","['Timothée Chalamet', 'Zendaya', 'Rebecca Ferguson']",['Denis Villeneuve'],"Duke Paul Atreides joins the Fremen and begins a spiritual and martial journey to become Muad'dib, while trying to prevent the horrible but inevitable future he's witnessed: a Holy War in his name, spreading throughout the known universe.",01 Mar 2024,92%,https://m.media-amazon.com/images/M/MV5BNTc0YmQxMjEtODI5MC00NjFiLTlkMWUtOGQ5NjFmYWUyZGJhXkEyXkFqcGc@._V1_SX300.jpg,166 min,8.5
66d5a93eb98715a0131a8aac,tt9362722,2023,Spider-Man: Across the Spider-Verse,"['Animation', 'Action', 'Adventure']","['Shameik Moore', 'Hailee Steinfeld', 'Brian Tyree Henry']","['Joaquim Dos Santos', 'Kemp Powers', 'Justin K. Thompson']","Miles Morales returns for the next chapter of the Oscar®-winning Spider-Verse saga, an epic adventure that will transport Brooklyn's full-time, friendly neighborhood Spider-Man across the Multiverse to join forces with Gwen Stacy and a new team of Spider-People to face off with a villain more powerful than anything they have ever encountered.",02 Jun 2023,95%,https://m.media-amazon.com/images/M/MV5BMzI0NmVkMjEtYmY4MS00ZDMxLTlkZmEtMzU4MDQxYTMzMjU2XkEyXkFqcGdeQXVyMzQ0MzA0NTM@._V1_SX300.jpg,140 min,8.6
