_id,id,year,title,genres,actors,director,plot,release_date,rotten_tomatoes,poster,runtime,imdb_rating
66d5cbc566b2f0d84bfd5454,tt15575470,2022,Project Wolf Hunting,"['Action', 'Crime', 'Horror']","['Seo In-Guk', 'Jang Dong-yoon', 'Jung So-min']",['Hongsun Kim'],"Follows dangerous criminals on a cargo ship who are transported from the Philippines to South Korea, as they unleash a sinister force after an escape attempt leads to a riot.",21 Sep 2022,53/100,https://m.media-amazon.com/images/M/MV5BNmZmYTJmMWYtNGIwNS00NTA1LWEyNmMtM2MyNTZlYWQ0NWY0XkEyXkFqcGdeQXVyNDYzNDg2MTM@._V1_SX300.jpg,122 min,6.0
66e60d6be2f69f45e61cb32b,tt5433138,2021,F9: The Fast Saga,"['Action', 'Crime', 'Thriller']","['Vin Diesel', 'Michelle Rodriguez', 'Jordana Brewster']",['Justin Lin'],Dom and the crew must take on an international terrorist who turns out to be Dom and Mia's estranged brother.,25 Jun 2021,59%,https://m.media-amazon.com/images/M/MV5BMjI0NmFkYzEtNzU2YS00NTg5LWIwYmMtNmQ1MTU0OGJjOTMxXkEyXkFqcGdeQXVyMjMxOTE0ODA@._V1_SX300.jpg,143 min,5.2
66d5ce9266b2f0d84bfd5536,tt14391088,2021,The Monkey King: Reborn,"['Animation', 'Action', 'Fantasy']","['Yenni Ann', 'Xuecen Bai', 'Zhongyang Baomu']",['Yunfei Wang'],"After short-tempered trickster Monkey King is insulted while visiting a temple with his master Tang Monk, he destroys a magical tree and accidentally releases the ancient King of Demons, who kidnaps Tang Monk as revenge for his long imprisonment. Now, Monkey King and his fellow disciples must rescue their master within three days, before the Demon King regains his full power and unleashes his armies to destroy the earth.",02 Apr 2021,,https://m.media-amazon.com/images/M/MV5BMDdjMGY2YjgtZjMxNC00MzFlLWI2OTgtMThkOWNjOTcwYTE1XkEyXkFqcGdeQXVyNzg5MzIyOA@@._V1_SX300.jpg,95 min,6.0
66e1ec629a310417bb9e48e8,tt14509110,2023,No One Will Save You,"['Horror', 'Sci-Fi', 'Thriller']","['Kaitlyn Dever', 'Elizabeth Kaluev', 'Zack Duhame']",['Brian Duffield'],An exiled anxiety-ridden homebody must battle an alien who's found its way into her home.,22 Sep 2023,82%,https://m.media-amazon.com/images/M/MV5BMGNhZDczNTUtOWEzZS00ZjEyLTkzODQtOGM1MTZiMGY2ODIyXkEyXkFqcGdeQXVyMjkwOTAyMDU@._V1_SX300.jpg,93 min,6.3
66e60d6be2f69f45e61cb32c,tt23705298,2022,The Black Phone (2022),['N/A'],['N/A'],['N/A'],N/A,19 Aug 2022,,N/A,N/A,N/A
66d5cbef66b2f0d84bfd5460,tt2382320,2021,No Time to Die,"['Action', 'Adventure', 'Thriller']","['Daniel Craig', 'Ana de Armas', 'Rami Malek']",['Cary Joji Fukunaga'],"Bond has left active service and is enjoying a tranquil life in Jamaica. His peace is short-lived when his old friend Felix Leiter from the CIA turns up asking for help. The mission to rescue a kidnapped scientist turns out to be far more treacherous than expected, leading Bond onto the trail of a mysterious villain armed with dangerous new technology.",08 Oct 2021,83%,https://m.media-amazon.com/images/M/MV5BYWQ2NzQ1NjktMzNkNS00MGY1LTgwMmMtYTllYTI5YzNmMmE0XkEyXkFqcGdeQXVyMjM4NTM5NDY@._V1_SX300.jpg,163 min,7.3
66d5ce2e66b2f0d84bfd5515,tt10327252,2021,The Forever Purge,"['Action', 'Crime', 'Horror']","['Ana de la Reguera', 'Tenoch Huerta', 'Josh Lucas']",['Everardo Gout'],All the rules are broken as a sect of lawless marauders decides that the annual Purge does not stop at daybreak and instead should never end.,02 Jul 2021,49%,https://m.media-amazon.com/images/M/MV5BMGE5NjJjNGMtZDkwMy00MGFlLWFkYTktYWFkNTY1NjcwOTY2XkEyXkFqcGdeQXVyMDM2NDM2MQ@@._V1_SX300.jpg,103 min,5.4
66df52e7a244d12c423514b8,tt6246322,2021,Don't Breathe 2,"['Action', 'Crime', 'Horror']","['Stephen Lang', 'Madelyn Grace', 'Brendan Sexton III']",['Rodo Sayagues'],"Hiding out for years in an isolated cabin, Norman Nordstrom has taken in and raised a young girl orphaned from a house fire. Their quiet existence is shattered when a group of kidnappers show up and take the girl, forcing Norman to leave his safe haven to save her.",13 Aug 2021,46/100,https://m.media-amazon.com/images/M/MV5BNjgzMjQ4NjMtNzQ5OS00MzE4LWIxMmMtNjI0YjM1ZWZiN2U2XkEyXkFqcGdeQXVyODE5NzE3OTE@._V1_SX300.jpg,98 min,6.0
66d5cc9a66b2f0d84bfd5496,tt11832046,2021,PAW Patrol: The Movie,"['Animation', 'Action', 'Adventure']","['Tyler Perry', 'Ron Pardo', 'Will Brisbin']",['Cal Brunker'],"When the PAW Patrol's biggest rival, Mayor Humdinger, becomes Mayor of nearby Adventure City and starts wreaking havoc, Ryder and everyone's favorite heroic pups kick into high gear to face the challenge head-on. While one of the pups must face his past in Adventure City, the team finds help from a new ally, the savvy dachshund Liberty. Together, armed with exciting new gadgets and gear, the PAW Patrol fights to save the citizens of Adventure City and stop Mayor Humdinger from destroying the bustling metropolis.",20 Aug 2021,80%,https://m.media-amazon.com/images/M/MV5BYTJmM2Q1YTMtZjQ1Yi00NGYzLTlhZWEtOTc1NGJkMjYzMTQ4XkEyXkFqcGc@._V1_SX300.jpg,86 min,6.1
66d5cbe366b2f0d84bfd545c,tt6906292,2023,Retribution,"['Action', 'Thriller']","['Liam Neeson', 'Noma Dumezweni', 'Lilly Aspell']",['Nimród Antal'],A bank executive receives a bomb threat while driving his children to school that his car will explode if they stop and get out.,25 Aug 2023,29%,https://m.media-amazon.com/images/M/MV5BNTEwYTMyNmUtNmU5OS00NTg2LTk4ZjEtOGJlZWViMWFlMjY1XkEyXkFqcGdeQXVyMDM2NDM2MQ@@._V1_SX300.jpg,91 min,5.3
66e25b619a310417bb9e4928,tt19713090,2022,The Killer,"['Action', 'Crime', 'Thriller']","['Jang Hyuk', 'Seo-young Lee', 'Bang Eun-Jung']",['Jae-Hoon Choi'],"A retired hitman agrees to take care of a teen aged girl, but when she becomes involved with unsavory people, he has to rescue her.",07 Mar 2023,82%,https://m.media-amazon.com/images/M/MV5BOTJlYzYxMDQtOWZhYi00NjE0LWFkOTAtNmJhNDNmODFkZjU2XkEyXkFqcGdeQXVyOTM0ODMzNTc@._V1_SX300.jpg,95 min,6.6
66d5cda066b2f0d84bfd54e8,tt10838180,2021,The Matrix Resurrections,"['Action', 'Sci-Fi']","['Keanu Reeves', 'Carrie-Anne Moss', 'Yahya Abdul-Mateen II']",['Lana Wachowski'],"Return to a world of two realities: one, everyday life; the other, what lies behind it. To find out if his reality is a construct, to truly know himself, Mr. Anderson will have to choose to follow the white rabbit once more.",22 Dec 2021,63%,https://m.media-amazon.com/images/M/MV5BMGJkNDJlZWUtOGM1Ny00YjNkLThiM2QtY2ZjMzQxMTIxNWNmXkEyXkFqcGdeQXVyMDM2NDM2MQ@@._V1_SX300.jpg,148 min,5.7
66e1ec0b9a310417bb9e48d1,tt5834426,2022,Moonfall,"['Action', 'Adventure', 'Sci-Fi']","['Halle Berry', 'Patrick Wilson', 'John Bradley']",['Roland Emmerich'],"In Moonfall, a mysterious force knocks the Moon from its orbit around Earth and sends it hurtling on a collision course with life as we know it. With mere weeks before impact and the world on the brink of annihilation, NASA executive and former astronaut Jo Fowler is convinced she has the key to saving us all - but only one astronaut from her past, Brian Harper and a conspiracy theorist K.C. Houseman believe her. These unlikely heroes will mount an impossible last-ditch mission into space, leaving behind everyone they love, only to find that they just might have prepared for the wrong mission.",04 Feb 2022,35%,https://m.media-amazon.com/images/M/MV5BZjk0OWZiN2ItNmQ2YS00NTJmLTg0MjItNzM4NzBkMWM1ZTRlXkEyXkFqcGdeQXVyMjMxOTE0ODA@._V1_SX300.jpg,130 min,5.1
66d5ce0866b2f0d84bfd550a,tt8178634,2022,RRR,"['Action', 'Adventure', 'Drama']","['N.T. Rama Rao Jr.', 'Ram Charan', 'Ajay Devgn']",['S.S. Rajamouli'],"During the British era Malli a small tribal girl is taken away by British governor Scott Buxton and his wife Catherine against the wishes of her parents.A Rama Raju an Indian cop who works for the British army for him duty comes first and is very ruthless to revolutionary Indians but he is never credited for his due by British government.The British government find that a tribal Komaram Bheem who considers Malli his sister has started his search for her and could be an obstacle for the British army.The governor and his wife announces a special post for any officer who can bring Bheem to them,Rama Raju decides to take the matters in his hand and promises the government to bring him dead or alive.Bheem by now has reached he city in search of Malli and pretends to be a mechanic Afzal during a train accident on lake he and Rama Raju risk their lives and save a kid and become best of friends.But both man will clash with each other and will be thirsty for each other's blood to complete their missions.",25 Mar 2022,95%,https://m.media-amazon.com/images/M/MV5BODUwNDNjYzctODUxNy00ZTA2LWIyYTEtMDc5Y2E5ZjBmNTMzXkEyXkFqcGdeQXVyODE5NzE3OTE@._V1_SX300.jpg,187 min,7.8
66e1eb829a310417bb9e48b9,tt17506728,2022,One Week Friends,['Drama'],"['Jinmai Zhao', 'Lin Yi', 'Shen Yue']",['Gavin Lin'],"Lin Xiangzhi, a smart but lonely transfer student, is found that her memory can only last for seven days.",18 Jun 2022,,https://m.media-amazon.com/images/M/MV5BMjk5NGZhMDMtNTIzMi00ODMxLTg5MDAtMTM2MGM3Y2E1ZWJmXkEyXkFqcGc@._V1_SX300.jpg,106 min,N/A
66e1ec5e9a310417bb9e48e7,tt14895206,2022,Dead for a Dollar,"['Action', 'Drama', 'Western']","['Christoph Waltz', 'Willem Dafoe', 'Rachel Brosnahan']",['Walter Hill'],"A famed bounty hunter runs into his sworn enemy, a professional gambler and outlaw that he had sent to prison years before.",30 Sep 2022,53%,https://m.media-amazon.com/images/M/MV5BYTAyMmM4ZmYtZGZhMi00YmY3LTgyOWMtMjA0NGVkODMwNzA5XkEyXkFqcGdeQXVyMTUzMTg2ODkz._V1_SX300.jpg,107 min,5.4
66e1ec8a9a310417bb9e48ee,tt16368898,2024,Lights Out,"['Action', 'Thriller']","['Frank Grillo', 'Mekhi Phifer', 'Jaime King']",['Christian Sesma'],"A drifting ex-soldier turns underground fighter with the help of a just released ex-con, pitting them both against a crime boss, corrupt cops and hired killers.",16 Feb 2024,35%,https://m.media-amazon.com/images/M/MV5BYjBiNzJhYmItN2FlNi00NjA1LWIzOWYtYTdkZjcyOTdhMmMwXkEyXkFqcGdeQXVyMzQwMTY2Nzk@._V1_SX300.jpg,90 min,4.8
66d7adc8c6dc28fe94973e3f,tt14614892,2022,Dragon Ball Super: Super Hero,"['Animation', 'Action', 'Adventure']","['Masako Nozawa', 'Aya Hisakawa', 'Ryô Horikawa']",['Tetsuro Kodama'],The Red Ribbon Army from Goku's past has returned with two new androids to challenge him and his friends.,18 Aug 2022,93%,https://m.media-amazon.com/images/M/MV5BZmFjNzkwOGYtMzBlYS00NmI4LWIwOTAtMDhhMjY4ZDkwNzI0XkEyXkFqcGdeQXVyODUyNjMyOTE@._V1_SX300.jpg,100 min,7.1
66d5cd0666b2f0d84bfd54ba,tt32547088,2024,The Beast,"['Short', 'Horror']","['Philip Bedwell', 'Paul Dew', 'Andy Howarth']",['Zeph Smith'],"Off a career-threatening injury, an ageing wrestler traps himself in an echo chamber wherein violence begets status, pushing him into self-destruction",N/A,,https://m.media-amazon.com/images/M/MV5BNDY1YTU0OTMtOTVhNi00NGM4LTljMTItZjE0OGFiNTI2MzMzXkEyXkFqcGc@._V1_SX300.jpg,10 min,N/A
66e1ebe19a310417bb9e48c9,tt14550346,2023,Last Summer,"['Drama', 'Thriller']","['Léa Drucker', 'Samuel Kircher', 'Olivier Rabourdin']",['Catherine Breillat'],"Follows Anne, a brilliant lawyer who lives with her husband Pierre and their daughters. Anne gradually engages in a passionate relationship with Theo, Pierre's son from a previous marriage, putting her career and family life in da...",13 Sep 2023,86%,https://m.media-amazon.com/images/M/MV5BYTFhMWIzNmYtZDhkMi00OTE2LWE4YjQtNmIzN2FlNGQwMjdjXkEyXkFqcGdeQXVyODY0MDQ3NTI@._V1_SX300.jpg,104 min,6.3
66d5ce3f66b2f0d84bfd551b,tt27050277,2024,The Courier,"['Crime', 'Drama', 'Thriller']","['Arón Piper', 'María Pedraza', 'Luis Tosar']",['Daniel Calparsoro'],Follows a hustler and his rise to the top of the corruption that surrounded the real estate bubble after the arrival of the euro in Spain.,19 Jan 2024,33%,https://m.media-amazon.com/images/M/MV5BMWQzNDNjMjYtNzMyNi00OTUwLTgxOTEtZjMxMmNmODhiZTk1XkEyXkFqcGdeQXVyNjc5NjEzNA@@._V1_SX300.jpg,101 min,6.0
66d5cd1f66b2f0d84bfd54c2,tt13397574,2024,Mothers' Instinct,"['Drama', 'Thriller']","['Jessica Chastain', 'Anne Hathaway', 'Anders Danielsen Lie']",['Benoît Delhomme'],"Alice and Celine live a traditional lifestyle with successful husbands and sons of the same age. Life's perfect harmony is suddenly shattered after a tragic accident. Guilt, suspicion and paranoia combine to unravel their sisterly...",13 Aug 2024,56%,https://m.media-amazon.com/images/M/MV5BNGQ2ZDIzZWItNTI3NS00YWMzLWIxODQtZDQ4ODI0YjkyYjgzXkEyXkFqcGdeQXVyNjkyNzI2MTQ@._V1_SX300.jpg,94 min,6.3
66e25b679a310417bb9e4941,tt8080204,2023,Hypnotic,"['Action', 'Drama', 'Mystery']","['Ben Affleck', 'Alice Braga', 'JD Pardo']",['Robert Rodriguez'],A detective investigates a mystery involving his missing daughter and a secret government program.,12 May 2023,31%,https://m.media-amazon.com/images/M/MV5BNmNmNWNiMjUtZmYyMC00OWVhLThmMTItNjkxYzU4Yzk2NTdlXkEyXkFqcGdeQXVyMDc5ODIzMw@@._V1_SX300.jpg,93 min,5.5
66d7ae57c6dc28fe94973f82,tt3704428,2022,Elvis,"['Biography', 'Drama', 'Music']","['Tom Hanks', 'Austin Butler', 'Olivia DeJonge']",['Baz Luhrmann'],"The life of American music icon Elvis Presley, from his childhood to becoming a rock and movie star in the 1950s while maintaining a complex relationship with his manager, Colonel Tom Parker.",24 Jun 2022,77%,https://m.media-amazon.com/images/M/MV5BYzMzNTJjYmMtZTkxNS00MjI4LWI3YmQtOTQ4MDZjZDJlZjQyXkEyXkFqcGdeQXVyNjc0NzQzNTM@._V1_SX300.jpg,159 min,7.3
66d5cc5b66b2f0d84bfd5482,tt7888964,2021,Nobody,"['Action', 'Crime', 'Drama']","['Bob Odenkirk', 'Aleksey Serebryakov', 'Connie Nielsen']",['Ilya Naishuller'],"Emmy winner Bob Odenkirk (Better Call Saul, The Post, Nebraska) stars as Hutch Mansell, an underestimated and overlooked dad and husband, taking life's indignities on the chin and never pushing back. A nobody. When two thieves break into his suburban home one night, Hutch declines to defend himself or his family, hoping to prevent serious violence. His teenage son, Blake (Gage Munroe, The Shack), is disappointed in him and his wife, Becca (Connie Nielsen, Wonder Woman), seems to pull only further away. The aftermath of the incident strikes a match to Hutch's long-simmering rage, triggering dormant instincts and propelling him on a brutal path that will surface dark secrets and lethal skills. In a barrage of fists, gunfire and squealing tires, Hutch must save his family from a dangerous adversary (famed Russian actor Aleksey Serebryakov, Amazon's McMafia)-and ensure that he will never be underestimated as a nobody again.",26 Mar 2021,83%,https://m.media-amazon.com/images/M/MV5BMjM5YTRlZmUtZGVmYi00ZjE2LWIyNzAtOWVhMDk1MDdkYzhjXkEyXkFqcGdeQXVyMjMxOTE0ODA@._V1_SX300.jpg,92 min,7.4
66d5cabe66b2f0d84bfd5403,tt19862722,2024,Find Me Falling,"['Comedy', 'Music', 'Romance']","['Harry Connick Jr.', 'Agni Scott', 'Ali Fumiko Whitney']",['Stelana Kliris'],"After a failed comeback album, rock star John Allman escapes to a dreamy Mediterranean island, only to discover that his new cliffside home has an unfortunate notoriety that attracts unwanted visitors and an old flame.",19 Jul 2024,41%,https://m.media-amazon.com/images/M/MV5BOTllNzJmYjctNWMzZi00Yzc2LWE5MTMtNDBhNWU1NDdmMDFhXkEyXkFqcGc@._V1_SX300.jpg,93 min,6.3
66df531fa244d12c423514ed,tt17351924,2023,Saltburn,"['Drama', 'Thriller']","['Barry Keoghan', 'Jacob Elordi', 'Rosamund Pike']",['Emerald Fennell'],"A student at Oxford University finds himself drawn into the world of a charming and aristocratic classmate, who invites him to his eccentric family's sprawling estate for a summer never to be forgotten.",22 Dec 2023,71%,https://m.media-amazon.com/images/M/MV5BM2NmMDQ1ZWEtNDU4OS00MGIxLWEyMGMtMTM2YmFkYzNhYmMxXkEyXkFqcGdeQXVyMTM1NjM2ODg1._V1_SX300.jpg,131 min,7.0
66d7aeafc6dc28fe94974054,tt4513678,2021,Ghostbusters: Afterlife,"['Adventure', 'Comedy', 'Fantasy']","['Carrie Coon', 'Paul Rudd', 'Finn Wolfhard']",['Jason Reitman'],"When a single mom and her two kids arrive in a small town, they begin to discover their connection to the original Ghostbusters and the secret legacy their grandfather left behind.",19 Nov 2021,63%,https://m.media-amazon.com/images/M/MV5BMTVkNmVlYzItMjNkYy00MGE0LTk4MmQtOTFmNTUyYzg2NGEzXkEyXkFqcGdeQXVyMTI0NTA1MDI3._V1_SX300.jpg,124 min,7.0
66d7ada1c6dc28fe94973de3,tt16277242,2023,Society of the Snow,"['Adventure', 'Biography', 'Drama']","['Enzo Vogrincic', 'Agustín Pardella', 'Matías Recalt']",['J.A. Bayona'],The flight of a rugby team crashes on a glacier in the Andes. The few passengers who survive the crash find themselves in one of the world's toughest environments to survive.,04 Jan 2024,90%,https://m.media-amazon.com/images/M/MV5BYmI4MTllYTItMjllYi00ZTY2LWE0NmQtNjBmZWQ2ZmE4NjQ2XkEyXkFqcGdeQXVyMTEzMTI1Mjk3._V1_SX300.jpg,144 min,7.8
66e1ecdc9a310417bb9e4901,tt14121726,2022,Jeepers Creepers: Reborn,"['Horror', 'Mystery', 'Thriller']","['Jarreau Benjamin', 'Sydney Craven', 'Imran Adams']",['Timo Vuorensola'],"The film unfolds as the Horror Hound festival holds its first ever event in Louisiana, where it attracts hundreds of geeks, freaks and die-hard horror fans from far and wide. Among them is fanboy Chase and his girlfriend Laine, who is forced to come along for the ride. But as the event approaches, Laine begins to experience unexplained premonitions and disturbing visions associated with the town's past, and in particular, local legend/urban myth The Creeper. As the festival arrives and the blood-soaked entertainment builds to a frenzy, Laine believes that something unearthly has been summoned and that she is at the center of it.",19 Sep 2022,0%,https://m.media-amazon.com/images/M/MV5BYWMyNzlmZmItYjllYi00YzAwLTk2ZDctNWFlYmViZmMxZjVjXkEyXkFqcGdeQXVyMTUzMDA3Mjc2._V1_SX300.jpg,88 min,2.5
66d5ce6166b2f0d84bfd5526,tt6528290,2023,Knights of the Zodiac,"['Action', 'Adventure', 'Drama']","['Mackenyu', 'Famke Janssen', 'Madison Iseman']",['Tomasz Baginski'],"When a goddess of war reincarnates in the body of a young girl, street orphan Seiya discovers that he is destined to protect her and save the world. But only if he can face his own past and become a Knight of the Zodiac.",12 May 2023,21%,https://m.media-amazon.com/images/M/MV5BNjNlYzNhMTgtYTFlYi00ZDg4LWIwMGItZWU2OTY1NTk4MDdlXkEyXkFqcGdeQXVyMTYyMTYyOTcw._V1_SX300.jpg,112 min,4.4
66e1ecba9a310417bb9e48f9,tt13539646,2023,The Wandering Earth II,"['Action', 'Adventure', 'Drama']","['Jing Wu', 'Yi Sha', 'Yanmanzi Zhu']",['Frant Gwo'],"Humans built huge engines on the surface of the earth to find a new home. But the road to the universe is perilous. In order to save earth, young people once again have to step forward to start a race against time for life and death.",22 Jan 2023,79%,https://m.media-amazon.com/images/M/MV5BMzg5MTNkZGUtNGViNS00NzFlLTg1NDYtN2Y2NzY3NWNmNzg2XkEyXkFqcGc@._V1_SX300.jpg,173 min,6.7
66e1ebd99a310417bb9e48c7,tt22868844,2023,Black Clover: Sword of the Wizard King,"['Animation', 'Action', 'Adventure']","['Bryn Apprill', 'Tia Lynn Ballard', 'Steve Blum']",['Ayataka Tanemura'],"In a world where magic is everything, Asta, a boy who was born with no magic, aims to become the ""Wizard King"" to overcome adversity, prove his power, and keep his oath with his friends.",16 Jun 2023,86%,https://m.media-amazon.com/images/M/MV5BMjU0MWMzNTctMjM5MC00MmVhLWIzZjQtYzk3OGRiYjQ2NDk2XkEyXkFqcGdeQXVyMTEzMTI1Mjk3._V1_SX300.jpg,110 min,7.4
66e25b609a310417bb9e4920,tt10954984,2022,Nope,"['Horror', 'Mystery', 'Sci-Fi']","['Daniel Kaluuya', 'Keke Palmer', 'Brandon Perea']",['Jordan Peele'],The residents of a lonely gulch in inland California bear witness to an uncanny and chilling discovery.,22 Jul 2022,83%,https://m.media-amazon.com/images/M/MV5BMGIyNTI3NWItNTJkOS00MGYyLWE4NjgtZDhjMWQ4Y2JkZTU5XkEyXkFqcGdeQXVyNjY1MTg4Mzc@._V1_SX300.jpg,130 min,6.8
66e60d6ce2f69f45e61cb32d,tt17009348,2023,DogMan,"['Action', 'Crime', 'Drama']","['Caleb Landry Jones', 'Jojo T. Gibbs', 'Christopher Denham']",['Luc Besson'],"A boy, bruised by life, finds his salvation through the love of his dogs.",05 Apr 2024,60%,https://m.media-amazon.com/images/M/MV5BOGJiMDE5OWItMDhkOS00MDcyLTk3OWUtMDZlNGM0Mzk2OTJhXkEyXkFqcGdeQXVyMTM1NjM2ODg1._V1_SX300.jpg,115 min,6.8
66d5ccf866b2f0d84bfd54b6,tt26658104,2024,Imaginary,"['Horror', 'Mystery', 'Thriller']","['DeWanda Wise', 'Taegen Burns', 'Pyper Braun']",['Jeff Wadlow'],A woman returns to her childhood home to discover that the imaginary friend she left behind is very real and unhappy that she abandoned him.,08 Mar 2024,24%,https://m.media-amazon.com/images/M/MV5BM2Q2NjYzYzItNjAzYi00YzAwLWIyN2EtNDJkMzZkZGM1NTc2XkEyXkFqcGc@._V1_SX300.jpg,104 min,4.7
66e1ecce9a310417bb9e48fe,tt13223398,2022,Beast,"['Action', 'Adventure', 'Drama']","['Liyabuya Gongo', 'Martin Munro', 'Daniel Hadebe']",['Baltasar Kormákur'],A father and his two teenage daughters find themselves hunted by a massive rogue lion intent on proving that the Savanna has but one apex predator.,19 Aug 2022,69%,https://m.media-amazon.com/images/M/MV5BMWZhNWU2ZWQtN2MzMS00MTU5LTk1N2MtYjIzMGNhNGY1NGVjXkEyXkFqcGdeQXVyMjMxOTE0ODA@._V1_SX300.jpg,93 min,5.6
66d5cd8b66b2f0d84bfd54e2,tt8542964,2024,Sleeping Dogs,"['Crime', 'Mystery', 'Thriller']","['Russell Crowe', 'Karen Gillan', 'Marton Csokas']",['Adam Cooper'],"An ex-homicide detective with memory loss is forced to solve a brutal murder, only to uncover chilling secrets from his forgotten past.",22 Mar 2024,45%,https://m.media-amazon.com/images/M/MV5BNTg4NTY3ZmMtZGZhMC00NWYxLThjYmEtZGJhYjE1N2Y2YmZkXkEyXkFqcGdeQXVyNjE2MzI5ODM@._V1_SX300.jpg,110 min,6.1
66d7aeb7c6dc28fe94974066,tt0870154,2021,Jungle Cruise,"['Action', 'Adventure', 'Comedy']","['Dwayne Johnson', 'Emily Blunt', 'Edgar Ramírez']",['Jaume Collet-Serra'],"1916. Dreaming about saving countless lives and having another adventure, the feisty English feminist and doctor of botany, Dr Lily Houghton, embarks on a peril-laden mission to change the world. Along with her fashionable brother, MacGregor, Dr Houghton enlists the help of the arrogant, wisecracking riverboat skipper, Captain Frank Wolff, to guide them through the serpentine Amazon River in La Quila, his swift wooden boat. Now, as the intrepid trio ventures deeper and deeper into the heart of an impenetrable green maze, searching for something that cannot be found, a centuries-old curse and the ruthless aristocrat, Prince Joachim, threaten to put an end to their ambitious plans. And, sooner or later, the jungle always wins. Is it true that the Spanish conquistador, Don Aguirre, was lost in the same God-forsaken part of the world?",30 Jul 2021,62%,https://m.media-amazon.com/images/M/MV5BNDE1MGRlNTQtZjc4ZC00MTI0LWEwY2MtODk1YTM2NmFmYTNmXkEyXkFqcGdeQXVyODk4OTc3MTY@._V1_SX300.jpg,127 min,6.6
66d7aedfc6dc28fe949740c3,tt12003946,2022,Violent Night,"['Action', 'Comedy', 'Thriller']","['David Harbour', 'John Leguizamo', ""Beverly D'Angelo""]",['Tommy Wirkola'],"A team of elite mercenaries breaks into a wealthy family compound on Christmas Eve, taking everyone inside hostage. But the team isn't prepared for a surprise combatant: Santa Claus is on the grounds, and he's about to show why this Nick is no saint.",02 Dec 2022,73%,https://m.media-amazon.com/images/M/MV5BZmE5ODNmODYtNDg0MC00ZDc4LWEyZmItNTQ2MGQ5MGQxMzllXkEyXkFqcGc@._V1_SX300.jpg,112 min,6.7
66df5367a244d12c4235152c,tt5884796,2023,Plane,"['Action', 'Adventure', 'Thriller']","['Gerard Butler', 'Mike Colter', 'Tony Goldwyn']",['Jean-François Richet'],A pilot finds himself caught in a war zone after he's forced to land his commercial aircraft during a terrible storm.,13 Jan 2023,78%,https://m.media-amazon.com/images/M/MV5BNGRmNmNkYWUtNDgwNi00MjAxLWFkYTMtNDIwM2FhZDczYTQ0XkEyXkFqcGdeQXVyMTA1NjE5MTAz._V1_SX300.jpg,107 min,6.5
66d7ade7c6dc28fe94973e8a,tt27503384,2023,Perfect Days,['Drama'],"['Koji Yakusho', 'Tokio Emoto', 'Arisa Nakano']",['Wim Wenders'],"Hirayama cleans public toilets in Tokyo, lives his life in simplicity and daily tranquility. Some encounters also lead him to reflect on himself.",21 Dec 2023,96%,https://m.media-amazon.com/images/M/MV5BYjI2Njc4MGQtYzYwNC00MDQ1LTkyMzQtODY0NDk4NzZjNGMyXkEyXkFqcGdeQXVyMTM1NjM2ODg1._V1_SX300.jpg,124 min,7.9
66e60d6ce2f69f45e61cb32e,tt31064367,2024,Float,"['Short', 'Drama']","['Stacy Thunes', 'Alexandra Hannant']",['Jessica Dowse'],"Following the death of her wife, Ruth encounters a fearless swimmer who pushes her to confront her pain and rediscover the joy of living.",N/A,,https://m.media-amazon.com/images/M/MV5BYTIwNzU5NGYtZjA2Yi00ZTcyLWIwZWYtOGUxN2VjYjg0YWI2XkEyXkFqcGdeQXVyODE5Mjk1OTc@._V1_SX300.jpg,12 min,N/A
66d7aef5c6dc28fe949740fa,tt18925334,2022,Pearl,"['Drama', 'Horror', 'Thriller']","['Mia Goth', 'David Corenswet', 'Tandi Wright']",['Ti West'],"In 1918, a young woman on the brink of madness pursues stardom in a desperate attempt to escape the drudgery, isolation, and lovelessness of life on her parents' farm.",16 Sep 2022,92%,https://m.media-amazon.com/images/M/MV5BZTFkNmE5MjUtZDE1Yi00ZmQyLTk2YWUtN2EwODA1ZmNlOTA5XkEyXkFqcGdeQXVyMTM1MTE1NDMx._V1_SX300.jpg,103 min,7.0
66e25b6f9a310417bb9e495a,tt4998632,2022,Ambulance,"['Action', 'Crime', 'Drama']","['Jake Gyllenhaal', 'Yahya Abdul-Mateen II', 'Eiza González']",['Michael Bay'],Two robbers steal an ambulance after their heist goes awry.,08 Apr 2022,68%,https://m.media-amazon.com/images/M/MV5BYjUyN2VlZGEtNGEyZC00YjViLTgwYmQtZDJiM2FlOTU3Mjg2XkEyXkFqcGdeQXVyMjMxOTE0ODA@._V1_SX300.jpg,136 min,6.1
66e1ec4f9a310417bb9e48e3,tt15486810,2023,Teen Wolf: The Movie,"['Action', 'Drama', 'Fantasy']","['Tyler Posey', 'Crystal Reed', 'Holland Roden']",['Russell Mulcahy'],"A terrifying evil has emerged. The wolves howl once again, but only a Werewolf like Scott McCall, can gather both new allies and reunite trusted friends to fight back against what could be the most powerful and deadliest enemy.",26 Jan 2023,32%,https://m.media-amazon.com/images/M/MV5BYWYyZWU5NzctYjY4Zi00MzYyLTgxZTMtZjBmYWE2NGMwYTllXkEyXkFqcGdeQXVyODk4OTc3MTY@._V1_SX300.jpg,141 min,5.6
